{
  "name": "tBTC v2",
  "symbol": "tBTC",
  "decimals": 18,
  "description": "Decentralized, Permissionless Bitcoin Bridge",
  "website": "https://threshold.network",
  "twitter": "@TheTNetwork",
  "tokens": {
    "ethereum": {
      "address": "0x18084fbA666a33d37592fA2633fD49a74DD93a88",
      "bridge": {
        "bob": "0x3F6cE1b36e5120BBc59D0cFe8A5aC8b6464ac1f7"
      }
    },
    "sepolia": {
      "address": "0x517f2982701695D4E52f1ECFBEf3ba31Df470161"
    },
    "bob": {
      "address": "0xBBa2eF945D523C4e2608C9E1214C2Cc64D4fc2e2",
      "bridge": {
        "ethereum": "0x4200000000000000000000000000000000000010"
      }
    },
    "bob-sepolia": {
      "name": "BOB tBTC v2",
      "address": "0xD23F06550b0A7bC98B20eb81D4c21572a97598FA"
    },
    "op-mainnet": {
      "name": "Optimism tBTC v2",
      "address": "0x6c84a8f1c29108F47a79964b5Fe888D4f4D0dE40"
    },
    "arbitrum-one": {
      "name": "Arbitrum tBTC v2",
      "address": "0x6c84a8f1c29108F47a79964b5Fe888D4f4D0dE40"
    },
    "base": {
      "address": "0x236aa50979D5f3De3Bd1Eeb40E81137F22ab794b"
    }
  }
}
