{
  "name": "Wrapped Ether",
  "symbol": "WETH",
  "decimals": 18,
  "tokens": {
    "ethereum": {
      "address": "0xC02aaA39b223FE8D0A0e5C4F27eAD9083C756Cc2",
      "bridge": {
        "bob": "0x3F6cE1b36e5120BBc59D0cFe8A5aC8b6464ac1f7"
      }
    },
    "sepolia": {
      "address": "0x7b79995e5f793A07Bc00c21412e50Ecae098E7f9"
    },
    "bob": {
      "address": "0x4200000000000000000000000000000000000006",
      "bridge": { "ethereum": "0x4200000000000000000000000000000000000010" }
    },
    "bob-sepolia": {
      "address": "0x4200000000000000000000000000000000000006"
    },
    "op-mainnet": {
      "address": "0x4200000000000000000000000000000000000006"
    },
    "base": {
      "address": "0x4200000000000000000000000000000000000006"
    }
  }
}
