{
  "name": "Staked Frax",
  "symbol": "sFRAX",
  "decimals": 18,
  "tokens": {
    "ethereum": {
      "address": "0xA663B02CF0a4b149d2aD41910CB81e23e1c41c32",
      "bridge": {
        "bob": "0x3F6cE1b36e5120BBc59D0cFe8A5aC8b6464ac1f7"
      }
    },
    "bob": {
      "address": "0xb7eae04B995B3b365040dEE99795112ADD43afa0",
      "bridge": {
        "ethereum": "0x4200000000000000000000000000000000000010"
      }
    }
  }
}
