{
  "name": "xSolvBTC",
  "symbol": "xSolvBTC",
  "decimals": 18,
  "description": "",
  "website": "https://app.solv.finance/",
  "twitter": "@SolvProtocol",
  "tokens": {
    "ethereum": {
      "address": "0xd9D920AA40f578ab794426F5C90F6C731D159DEf"
    },
    "bob": {
      "address": "0xCC0966D8418d412c599A6421b760a847eB169A8c"
    },
    "bnb-smart-chain": {
      "address": "0x1346b618dc92810ec74163e4c27004c921d446a5"
    },
    "avalanche": {
      "address": "0xcc0966d8418d412c599a6421b760a847eb169a8c"
    },
    "base": {
      "address": "0xc26c9099bd3789107888c35bb41178079b282561"
    },
    "arbitrum-one": {
      "address": "0x346c574c56e1a4aaa8dc88cda8f7eb12b39947ab"
    },
    "polygon": {
      "address": "0xc99f5c922dae05b6e2ff83463ce705ef7c91f077"
    }
  }
}
