{
  "name": "BOB",
  "symbol": "BOB",
  "decimals": 18,
  "description": "",
  "website": "https://app.gobob.xyz/",
  "twitter": "@build_on_bob",
  "tokens": {
    "ethereum": {
      "address": "0xC9746F73cC33a36c2cD55b8aEFD732586946Cedd",
      "bridge": {
        "bob": "0x80226fc0Ee2b096224EeAc085Bb9a8cba1146f7D",
        "bnb-smart-chain": "0x80226fc0Ee2b096224EeAc085Bb9a8cba1146f7D"
      }
    },
    "bob": {
      "address": "0xb0bd54846a92b214c04a63b26ad7dc5e19a60808",
      "bridge": {
        "ethereum": "0x827716e74F769AB7b6bb374A29235d9c2156932C",
        "bnb-smart-chain": "0x827716e74F769AB7b6bb374A29235d9c2156932C"
      }
    },
    "bob-sepolia": {
      "address": "0x49D6FBFa3Ee5462626D65Cd22FC0CFb03ed907DB"
    },
    "bnb-smart-chain": {
      "address": "0x52B5fB4B0F6572B8C44d0251Cc224513ac5eB7E7",
      "bridge": {
        "ethereum": "0x34B03Cb9086d7D758AC55af71584F81A598759FE",
        "bob": "0x34B03Cb9086d7D758AC55af71584F81A598759FE"
      }
    }
  }
}
