{
  "name": "StakeStone Ether",
  "symbol": "STONE",
  "decimals": 18,
  "tokens": {
    "ethereum": {
      "address": "0x7122985656e38BDC0302Db86685bb972b145bD3C",
      "bridge": {
        "bob": "0x3F6cE1b36e5120BBc59D0cFe8A5aC8b6464ac1f7"
      }
    },
    "bob": {
      "address": "0x96147A9Ae9a42d7Da551fD2322ca15B71032F342",
      "bridge": {
        "ethereum": "0x4200000000000000000000000000000000000010"
      }
    }
  }
}
