{
  "name": "Wrapped BTC",
  "symbol": "WBTC",
  "decimals": 8,
  "description": "Wrapped Bitcoin delivers the power of Bitcoin with the flexibility of an ERC20 token",
  "website": "https://wbtc.network/",
  "twitter": "@WrappedBTC",
  "tokens": {
    "ethereum": {
      "address": "0x2260FAC5E5542a773Aa44fBCfeDf7C193bc2C599",
      "bridge": {
        "bob": "0x3F6cE1b36e5120BBc59D0cFe8A5aC8b6464ac1f7"
      }
    },
    "bob": {
      "address": "0x03C7054BCB39f7b2e5B2c7AcB37583e32D70Cfa3",
      "bridge": {
        "ethereum": "0x4200000000000000000000000000000000000010"
      },
      "overrides": {
        "name": "Bridged WBTC"
      }
    },
    "arbitrum-one": {
      "address": "0x2f2a2543b76a4166549f7aab2e75bef0aefc5b0f"
    },
    "op-mainnet": {
      "address": "0x68f180fcce6836688e9084f035309e29bf0a2095"
    }
  }
}
