{
  "name": "Fire Bitcoin",
  "symbol": "FBTC",
  "decimals": 8,
  "tokens": {
    "ethereum": {
      "address": "0xC96dE26018A54D51c097160568752c4E3BD6C364",
      "bridge": {
        "bob": "0x3F6cE1b36e5120BBc59D0cFe8A5aC8b6464ac1f7"
      }
    },
    "bob": {
      "address": "0xC96dE26018A54D51c097160568752c4E3BD6C364",
      "bridge": {
        "ethereum": "0x4200000000000000000000000000000000000010"
      }
    }
  }
}
