{
  "name": "Uniswap",
  "symbol": "UNI",
  "decimals": 18,
  "tokens": {
    "ethereum": {
      "address": "0x1f9840a85d5aF5bf1D1762F925BDADdC4201F984",
      "bridge": {
        "bob": "0x3F6cE1b36e5120BBc59D0cFe8A5aC8b6464ac1f7"
      }
    },
    "bob": {
      "address": "0x6fD31f56eb971113bEA12C5883deC68337b3B7b5",
      "bridge": {
        "ethereum": "0x4200000000000000000000000000000000000010"
      }
    },
    "op-mainnet": {
      "address": "0x6fd9d7AD17242c41f7131d257212c54A0e816691"
    },
    "base": {
      "address": "0xc3De830EA07524a0761646a6a4e4be0e114a3C83"
    }
  }
}
