{
  "name": "Ether",
  "symbol": "ETH",
  "decimals": 18,
  "tokens": {
    "ethereum": {
      "address": "0x0000000000000000000000000000000000000000"
    },
    "sepolia": {
      "address": "0x0000000000000000000000000000000000000000"
    },
    "bob": {
      "address": "0x0000000000000000000000000000000000000000"
    },
    "bob-sepolia": {
      "address": "0x0000000000000000000000000000000000000000"
    },
    "bnb-smart-chain": {
      "address": "0x0000000000000000000000000000000000000000",
      "overrides": {
        "name": "BNB",
        "symbol": "BNB"
      }
    }
  }
}
