{
  "name": "Wrapped BTC",
  "symbol": "WBTC",
  "decimals": 8,
  "description": "Wrapped Bitcoin delivers the power of Bitcoin with the flexibility of an ERC20 token",
  "website": "https://layerzero.network",
  "twitter": "@layerzero_core",
  "tokens": {
    "ethereum": {
      "address": "0x0555E30da8f98308EdB960aa94C0Db47230d2B9c"
    },
    "bob": {
      "address": "0x0555E30da8f98308EdB960aa94C0Db47230d2B9c"
    },
    "bnb-smart-chain": {
      "address": "0x0555e30da8f98308edb960aa94c0db47230d2b9c"
    },
    "op-mainnet": {
      "address": "0xc3f854b2970f8727d28527ece33176fac67fef48"
    },
    "base": {
      "address": "0x0555e30da8f98308edb960aa94c0db47230d2b9c"
    },
    "avalanche": {
      "address": "0x0555e30da8f98308edb960aa94c0db47230d2b9c"
    },
    "swellchain": {
      "address": "0x0555e30da8f98308edb960aa94c0db47230d2b9c"
    },
    "sei-network": {
      "address": "0x0555e30da8f98308edb960aa94c0db47230d2b9c"
    },
    "soneium-mainnet": {
      "address": "0x0555e30da8f98308edb960aa94c0db47230d2b9c"
    },
    "berachain": {
      "address": "0x0555e30da8f98308edb960aa94c0db47230d2b9c"
    },
    "unichain": {
      "address": "0x0555e30da8f98308edb960aa94c0db47230d2b9c"
    },
    "sonic": {
      "address": "0x0555e30da8f98308edb960aa94c0db47230d2b9c"
    },
    "telos": {
      "address": "0x0555e30da8f98308edb960aa94c0db47230d2b9c"
    }
  }
}
